{
  "dataset_id": "dataset_a1b2c3d4e5f67890abcdef12",
  "mission_id": "mission_b2c3d4e5f6a78901bcdef123",
  "field_id": "field_c3d4e5f6a7b89012cdef1234",
  "drone_type": "DJI_MAVIC_3M",
  "drone_serial": "1ZNBJ1T00C00B6",
  "status": "RAW_INGESTED",
  "file_count": 247,
  "total_size_bytes": 3758096384,
  "manifest_hash": null,
  "signature": null,
  "intake_manifest_ref": null,
  "calibration_result_ref": null,
  "qc_report_ref": null,
  "rejection_reason": null,
  "created_at": "2026-03-01T08:30:00Z",
  "updated_at": null,
  "archived_at": null
}
